question_id,question_type,domain,category,subcategory,pillar,item,question_text_ko,question_text_vi,answer_type,unit,framework_refs,forbidden_rule,must_return_insufficient_if_missing,notes,status
QN-001,quantitative,Social,Constituent profile,Total employees,,,,"","Tong so nhan su cua cong ty trong nam bao cao la bao nhieu?",number,person,"GRI:2-7-a","Khong duoc suy doan neu tai lieu chi mo ta xu huong ma khong co so lieu",true,"Seed tu mau dinh luong: 사회 / 구성원 현황 / 총 구성원 수",draft
QN-002,quantitative,Social,Constituent profile,Gender,Female,,,"","Ty le nhan su nu trong tong lao dong la bao nhieu phan tram?",percentage,%,"GRI:405-1-b-i; K-ESG:S-3-1","Khong duoc tu tinh neu tai lieu chi co so luong mot phan va thieu tong mau",true,"Seed tu mau dinh luong: 사회 / 구성원 현황 / 성별 / 여성",draft
QN-003,quantitative,Environment,Water resources,,,,,"","Luong nuoc su dung trong nam bao cao la bao nhieu?",number,custom,"","Khong duoc tra loi bang metric khac don vi neu khong co quy tac quy doi",true,"Can bo sung unit cu the sau khi chot question bank",draft
QL-001,qualitative,General,ESG management,,Strategy,ESG vision and mid-long term strategy,"","Cong ty mo ta chien luoc ESG va dinh huong trung dai han nhu the nao?",long_text,,"","","false","Seed tu mau dinh tinh: 일반 / ESG 경영 / 전략 / ESG 비전 및 중장기 전략",draft
QL-002,qualitative,General,ESG management,,Governance,ESG governance and decision making,"","Co che quan tri va ra quyet dinh lien quan den ESG duoc to chuc ra sao?",long_text,,"","","false","Seed tu mau dinh tinh: 일반 / ESG 경영 / 거버넌스 / ESG 거버넌스 및 의사결정 체계",draft
QL-003,qualitative,Social,Safety and health,,Risk Management,Safety risk identification and management,"","Cong ty nhan dien va quan ly rui ro ve an toan suc khoe nhu the nao?",long_text,,"","","false","Co the doi lai wording sau khi review voi SME",draft
