silver_id,ground_truth_record_id,company,question_type,difficulty,question,ground_truth_answer,evidence_span,qc_decision,qc_reason,faithfulness_status,answer_relevancy_status,groundedness_status,duplicate_flag,needs_rewrite,promotion_candidate,review_notes
SV2-P24-0001,rec_3adad134db5cb9c2,한샘,qualitative_strategy,medium,한샘은 ESG 경영을 위해 어떤 중대 이슈를 선정했나요?,"기후변화 완화, 책임있는 조달, 지속 가능한 제품 설계, 사업장 근무 조건, 인권경영, 협력사 동반성장, 제품 안전 및 품질, 공정거래 등 총 8개 중대 이슈를 선정했다.",이중 중대성 평가를 통해 ▲기후변화 완화 ▲책임있는 조달 ▲지속 가능한 제품 설계 ▲사업장 근무 조건 ▲인권경영 ▲협력사 동반성장 ▲제품 안전 및 품질 ▲공정거래 등 총 8개 중대 이슈를 선정했다.,revise,duplicate_same_fact_cluster_in_batch,pass,pass,pass,True,True,no,Trùng fact cluster với row khác trong batch (8개 중대 이슈). Giữ 1 row/batch cho fact cluster; cân nhắc giữ bản quantitative (0004) hoặc narrative (0001).
SV2-P24-0002,rec_41a160ead0ae1be6,한샘,qualitative_strategy,easy,한샘은 2050년까지 어떤 목표를 달성할 계획인가요?,2050년까지 ‘탄소중립(Net Zero·넷제로)’을 달성하는 목표를 공개했다.,2050년까지 ‘탄소중립(Net Zero·넷제로)’을 달성하는 목표를 공개했다.,revise,single_partial_rubric_score,pass,pass,partial,False,True,no,Unit có news chrome; evidence_span vẫn grounded.
SV2-P24-0003,rec_5edea297fe4ab1d8,한샘,qualitative_narrative,easy,한샘은 올해 지속가능경영보고서에 어떤 보고서를 수록했나요?,TCFD(Task Force on Climate-related Financial Disclosure·기후변화 관련 재무공개 협의체) 보고서도 수록했다.,특히 한샘은 올해 지속가능경영보고서에 TCFD(Task Force on Climate-related Financial Disclosure·기후변화 관련 재무공개 협의체) 보고서도 수록했다.,pass,all_rubric_pass_no_duplicate,pass,pass,pass,False,False,yes,Sẵn sàng promote gold pilot mini-set.
SV2-P24-0004,rec_2d0cf95b00a0fefc,한샘,quantitative_fact,easy,한샘은 2025 지속가능경영보고서에서 몇 개의 중대 이슈를 선정했나요?,총 8개 중대 이슈를 선정했다.,한샘은 이중 중대성 평가를 통해 ▲기후변화 완화 ▲책임있는 조달 ▲지속 가능한 제품 설계 ▲사업장 근무 조건 ▲인권경영 ▲협력사 동반성장 ▲제품 안전 및 품질 ▲공정거래 등 총 8개 중대 이슈를 선정했다.,revise,duplicate_same_fact_cluster_in_batch,pass,pass,partial,True,True,no,Trùng fact cluster với row khác trong batch (8개 중대 이슈). Unit có news chrome; evidence_span vẫn grounded. Giữ 1 row/batch cho fact cluster; cân nhắc giữ bản quantitative (0004) hoặc narrative (0001).
SV2-P24-0005,rec_ba9d092227fde816,한샘,quantitative_fact,easy,한샘은 2022년 ESG 경영 평가에서 어떤 등급을 획득했나요?,전년 대비 1등급 상승한 ‘A’등급을 획득했다.,"한샘은 지난해 한국기업지배구조원(KGCS)의 ESG경영 평가 결과, 전년 대비 1등급 상승한 ‘A’등급을 획득했다.",revise,single_partial_rubric_score,pass,pass,partial,False,True,no,Unit có news chrome; evidence_span vẫn grounded.
